SQL> create table employee(name varchar2(10),da number(10),hr number(10),ta number(10),salary number(10));

Table created.


SQL> insert into employee values('&name','&da','&hr','&ta','&salary');
Enter value for name: ANIL
Enter value for da: 1000
Enter value for hr: 2000
Enter value for ta: 1000
Enter value for salary: 15000
old   1: insert into employee values('&name','&da','&hr','&ta','&salary')
new   1: insert into employee values('ANIL','1000','2000','1000','15000')

1 row created.

SQL> insert into employee values('&name','&da','&hr','&ta','&salary');
Enter value for name: ASHWIN
Enter value for da: 1000
Enter value for hr: 3000
Enter value for ta: 15000
Enter value for salary: 20000
old   1: insert into employee values('&name','&da','&hr','&ta','&salary')
new   1: insert into employee values('ASHWIN','1000','3000','15000','20000')

1 row created.

SQL> insert into employee values('&name','&da','&hr','&ta','&salary');
Enter value for name: ARUN
Enter value for da: 500
Enter value for hr: 2000
Enter value for ta: 500
Enter value for salary: 90000
old   1: insert into employee values('&name','&da','&hr','&ta','&salary')
new   1: insert into employee values('ARUN','500','2000','500','90000')

1 row created.

SQL> insert into employee values('&name','&da','&hr','&ta','&salary');
Enter value for name: AMALA
Enter value for da: 900
Enter value for hr: 2500
Enter value for ta: 1000
Enter value for salary: 11000
old   1: insert into employee values('&name','&da','&hr','&ta','&salary')
new   1: insert into employee values('AMALA','900','2500','1000','11000')

1 row created.

SQL> insert into employee values('&name','&da','&hr','&ta','&salary');
Enter value for name: AMMU
Enter value for da: 1500
Enter value for hr: 1000
Enter value for ta: 2000
Enter value for salary: 100000
old   1: insert into employee values('&name','&da','&hr','&ta','&salary')
new   1: insert into employee values('AMMU','1500','1000','2000','100000')

1 row created.

SQL> select * from employee;

NAME               DA        hr         TA     SALARY
---------- ---------- ---------- ---------- ----------
ANIL            1000       2000       1000      15000
ASHWIN          1000       3000      15000      20000
ARUN             500       2000        500      90000
AMALA            900       2500       1000      11000
AMMU            1500       1000       2000     100000


A)   SQL> create view empview as select name,salary from employee where salary >10000;

      View created.

     SQL> select * from empview;

       NAME           SALARY
      ---------- ----------
       ANIL          15000
       ASHWIN        20000
       ARUN          90000
       AMALA         11000
       AMMU          100000
	   
	   
B)   SQL> update employee set salary = 25000;

     5 rows updated.

     SQL> select * from employee;

       NAME            DA        hr         TA     SALARY
     ---------- ---------- ---------- ---------- ----------
       ANIL          1000       2000       1000      25000
       ASHWIN        1000       3000      15000      25000
       ARUN           500       2000        500      25000
       AMALA          900       2500       1000      25000
       AMMU          1500       1000       2000      25000

     SQL> select * from empview;

        NAME           SALARY
      ---------- ----------
        ANIL           25000
        ASHWIN         25000
        ARUN           25000
        AMALA          25000
        AMMU           25000

C)   SQL> update empview set salary = 1000;

     5 rows updated.

     SQL> select * from empview;

     no rows selected

     SQL> select * from employee;

       NAME           DA        hr         TA     SALARY
    ---------- ---------- ---------- ---------- ----------
       ANIL          1000       2000       1000       1000
       ASHWIN        1000       3000      15000       1000
       ARUN           500       2000        500       1000
       AMALA          900       2500       1000       1000
       AMMU          1500       1000       2000       1000